[
  {
    "id": "met-fifth-avenue",
    "rank": 1,
    "title": "The Metropolitan Museum of Art—The Met Fifth Avenue",
    "value": "5,984,091 visitors in 2025 (Art Newspaper global rank 5)",
    "institution_type": "encyclopedic art museum",
    "website": "https://www.metmuseum.org/",
    "ranking": {
      "selection_tier": "attendance_survey",
      "source_name": "The Art Newspaper Top 150 Museums 2025",
      "source_url": "https://www.ccb.pt/wp-content/uploads/2026/04/TOP150ArtNewspaper1.pdf",
      "source_rank": 5,
      "metric": "annual_visitors",
      "metric_value": 5984091,
      "metric_year": 2025
    },
    "location": {
      "address": "1000 Fifth Avenue",
      "city": "New York",
      "state": "NY",
      "postal_code": "10028",
      "coordinates": {
        "lat": 40.779444,
        "lng": -73.963333
      },
      "geocode_provider": "Wikidata",
      "geocode_crs": "WGS84 (EPSG:4326)",
      "geocode_source_url": "https://www.wikidata.org/wiki/Q160236",
      "geocoded_at": "2026-07-21"
    },
    "nearby_hotel": {
      "name": "The Mark",
      "address": "25 East 77th Street, New York, NY 10075",
      "coordinates": {
        "lat": 40.7753172,
        "lng": -73.9632598
      },
      "distance_miles": 0.285,
      "source_url": "https://www.openstreetmap.org/node/5356822882",
      "verified_at": "2026-07-21"
    },
    "admission": {
      "adult_general_usd": 30,
      "pricing_note": "Adults $30; eligible local residents and regional students may pay what they wish; same-day entry covers both Met locations.",
      "as_of": "2026-07-21",
      "source_url": "https://www.metmuseum.org/plan-your-visit"
    },
    "collection": {
      "summary": "More than 1.5 million objects spanning 5,000 years and cultures worldwide.",
      "object_count": 1500000,
      "notable_artists": [
        "Emanuel Leutze",
        "Vincent van Gogh",
        "Rembrandt van Rijn"
      ],
      "notable_works": [
        {
          "title": "Washington Crossing the Delaware",
          "artist": "Emanuel Leutze",
          "year": "1851"
        }
      ]
    },
    "institution_founded_year": 1870,
    "building": {
      "year_built": 1880,
      "architects": [
        "Calvert Vaux",
        "Jacob Wrey Mould",
        "Richard Morris Hunt"
      ],
      "square_feet": 2000000,
      "scope_note": "Approximate present-day area of the Fifth Avenue complex.",
      "history": "The Vaux–Mould building opened in 1880; Hunt's Fifth Avenue facade and Great Hall followed in 1902, with later wings surrounding the original structure."
    },
    "metrics": {
      "annual_visitors": 5984091,
      "attendance_year": 2025
    },
    "financial_value": {
      "kind": "net_assets",
      "amount_usd": 5767474000,
      "year": 2025,
      "basis": "Institution-wide audited net assets; the art collection is excluded from the balance sheet.",
      "source_url": "https://cdn.sanity.io/files/cctd4ker/production/8c8f7e0f1b355b04369b03753ecc265d246400a4.pdf"
    },
    "sources": [
      {
        "url": "https://www.ccb.pt/wp-content/uploads/2026/04/TOP150ArtNewspaper1.pdf",
        "supports": [
          "ranking",
          "metrics"
        ],
        "verified_at": "2026-07-21"
      },
      {
        "url": "https://www.metmuseum.org/plan-your-visit",
        "supports": [
          "location.address",
          "admission"
        ],
        "verified_at": "2026-07-21"
      },
      {
        "url": "https://www.metmuseum.org/about-the-met",
        "supports": [
          "collection.summary",
          "collection.object_count"
        ],
        "verified_at": "2026-07-21"
      },
      {
        "url": "https://www.metmuseum.org/about-the-met/history",
        "supports": [
          "institution_founded_year",
          "building"
        ],
        "verified_at": "2026-07-21"
      },
      {
        "url": "https://www.metmuseum.org/art/collection/search/11417",
        "supports": [
          "collection.notable_artists",
          "collection.notable_works"
        ],
        "verified_at": "2026-07-21"
      }
    ],
    "verified_at": "2026-07-21"
  },
  {
    "id": "national-gallery-of-art",
    "rank": 2,
    "title": "National Gallery of Art",
    "value": "2,847,587 visitors in 2025 (Art Newspaper global rank 18)",
    "institution_type": "national art museum",
    "website": "https://www.nga.gov/",
    "ranking": {
      "selection_tier": "attendance_survey",
      "source_name": "The Art Newspaper Top 150 Museums 2025",
      "source_url": "https://www.ccb.pt/wp-content/uploads/2026/04/TOP150ArtNewspaper1.pdf",
      "source_rank": 18,
      "metric": "annual_visitors",
      "metric_value": 2847587,
      "metric_year": 2025
    },
    "location": {
      "address": "Constitution Avenue NW between 3rd and 9th Streets",
      "city": "Washington",
      "state": "DC",
      "postal_code": "20565",
      "coordinates": {
        "lat": 38.891389,
        "lng": -77.02
      },
      "geocode_provider": "Wikidata",
      "geocode_crs": "WGS84 (EPSG:4326)",
      "geocode_source_url": "https://www.wikidata.org/wiki/Q214867",
      "geocoded_at": "2026-07-21"
    },
    "nearby_hotel": {
      "name": "Holiday Inn Washington Capitol",
      "address": "550 C Street Southwest, Washington, DC 20024",
      "coordinates": {
        "lat": 38.8855527,
        "lng": -77.0193752
      },
      "distance_miles": 0.405,
      "source_url": "https://www.openstreetmap.org/way/48037566",
      "verified_at": "2026-07-21"
    },
    "admission": {
      "adult_general_usd": 0,
      "pricing_note": "Admission is always free; no passes or tickets are required.",
      "as_of": "2026-07-21",
      "source_url": "https://www.nga.gov/visit/what-to-expect"
    },
    "collection": {
      "summary": "More than 160,000 works tracing Western art from the Middle Ages to the present.",
      "object_count": 160000,
      "notable_artists": [
        "Leonardo da Vinci",
        "Rembrandt van Rijn",
        "Johannes Vermeer"
      ],
      "notable_works": [
        {
          "title": "Ginevra de' Benci",
          "artist": "Leonardo da Vinci",
          "year": "c. 1474–1478"
        }
      ]
    },
    "institution_founded_year": 1937,
    "building": {
      "year_built": 1941,
      "architects": [
        "John Russell Pope",
        "I. M. Pei"
      ],
      "square_feet": null,
      "scope_note": "Year refers to the West Building; the campus also includes I. M. Pei's 1978 East Building and a sculpture garden.",
      "history": "Congress established the Gallery in 1937; the neoclassical West Building opened in 1941 and the modernist East Building in 1978."
    },
    "metrics": {
      "annual_visitors": 2847587,
      "attendance_year": 2025
    },
    "financial_value": {
      "kind": "endowment",
      "amount_usd": 926658000,
      "year": 2025,
      "basis": "Donor-restricted and board-designated private funds; federal appropriations fund core operations.",
      "source_url": "https://www.nga.gov/sites/default/files/2025-12/fy2025_performance_and_accountability_report_national_gallery_of_art_508_compliant.pdf"
    },
    "sources": [
      {
        "url": "https://www.ccb.pt/wp-content/uploads/2026/04/TOP150ArtNewspaper1.pdf",
        "supports": [
          "ranking",
          "metrics"
        ],
        "verified_at": "2026-07-21"
      },
      {
        "url": "https://www.nga.gov/visit/what-to-expect",
        "supports": [
          "location.address",
          "admission"
        ],
        "verified_at": "2026-07-21"
      },
      {
        "url": "https://www.nga.gov/about-us",
        "supports": [
          "collection.summary",
          "collection.object_count"
        ],
        "verified_at": "2026-07-21"
      },
      {
        "url": "https://www.nga.gov/national-gallery-history",
        "supports": [
          "institution_founded_year",
          "building"
        ],
        "verified_at": "2026-07-21"
      },
      {
        "url": "https://www.nga.gov/node/856441",
        "supports": [
          "collection.notable_artists",
          "collection.notable_works"
        ],
        "verified_at": "2026-07-21"
      }
    ],
    "verified_at": "2026-07-21"
  },
  {
    "id": "museum-of-modern-art",
    "rank": 3,
    "title": "Museum of Modern Art (MoMA)",
    "value": "2,763,720 visitors in 2025 (Art Newspaper global rank 19)",
    "institution_type": "modern and contemporary art museum",
    "website": "https://www.moma.org/",
    "ranking": {
      "selection_tier": "attendance_survey",
      "source_name": "The Art Newspaper Top 150 Museums 2025",
      "source_url": "https://www.ccb.pt/wp-content/uploads/2026/04/TOP150ArtNewspaper1.pdf",
      "source_rank": 19,
      "metric": "annual_visitors",
      "metric_value": 2763720,
      "metric_year": 2025
    },
    "location": {
      "address": "11 West 53rd Street",
      "city": "New York",
      "state": "NY",
      "postal_code": "10019",
      "coordinates": {
        "lat": 40.761667,
        "lng": -73.9775
      },
      "geocode_provider": "Wikidata",
      "geocode_crs": "WGS84 (EPSG:4326)",
      "geocode_source_url": "https://www.wikidata.org/wiki/Q188740",
      "geocoded_at": "2026-07-21"
    },
    "nearby_hotel": {
      "name": "Baccarat Hotel New York",
      "address": "28 West 53rd Street, New York, NY 10019",
      "coordinates": {
        "lat": 40.7608075,
        "lng": -73.9773637
      },
      "distance_miles": 0.06,
      "source_url": "https://www.openstreetmap.org/way/162755457",
      "verified_at": "2026-07-21"
    },
    "admission": {
      "adult_general_usd": 30,
      "pricing_note": "Adult admission is $30 and includes galleries and special exhibitions.",
      "as_of": "2026-07-21",
      "source_url": "https://visit.moma.org/select"
    },
    "collection": {